{
  "funnel_stages": [
    { "n": 1, "key": "impression", "canonical_event": "impression", "benchmark_step_cvr": null, "cost_line_group": "impression" },
    { "n": 2, "key": "click", "canonical_event": "click", "benchmark_step_cvr": 0.015, "cost_line_group": "click" },
    { "n": 3, "key": "lead", "canonical_event": "lead_created", "benchmark_step_cvr": 0.08, "cost_line_group": "lead" },
    { "n": 4, "key": "contact", "canonical_event": "lead_contacted", "benchmark_step_cvr": null, "cost_line_group": "contact" },
    { "n": 5, "key": "qualified", "canonical_event": "lead_qualified", "benchmark_step_cvr": null, "cost_line_group": "qualified" },
    { "n": 6, "key": "quote", "canonical_event": "quote_issued", "benchmark_step_cvr": null, "cost_line_group": "quote" },
    { "n": 7, "key": "policy", "canonical_event": "policy_issued", "benchmark_step_cvr": null, "cost_line_group": "policy" },
    { "n": 8, "key": "retained_13m", "canonical_event": "policy_retained_13m", "benchmark_step_cvr": 0.9, "cost_line_group": "retained_13m", "derived": true }
  ],
  "cost_ontology": [
    { "id": "C002", "stage": "impression", "mode": "direct" },
    { "id": "C003", "stage": "impression", "mode": "direct" },
    { "id": "C004", "stage": "impression", "mode": "direct" },
    { "id": "C010", "stage": "impression", "mode": "direct" },
    { "id": "C011", "stage": "impression", "mode": "allocated", "basis": "equal" },
    { "id": "C015", "stage": "impression", "mode": "direct" },
    { "id": "C017", "stage": "impression", "mode": "allocated", "basis": "equal" },
    { "id": "C073", "stage": "impression", "mode": "allocated", "basis": "equal", "leakage_flag": true },
    { "id": "C078", "stage": "impression", "mode": "direct", "leakage_flag": true },
    { "id": "C079", "stage": "impression", "mode": "direct", "leakage_flag": true },
    { "id": "C080", "stage": "impression", "mode": "direct", "leakage_flag": true },
    { "id": "C001", "stage": "click", "mode": "direct" },
    { "id": "C005", "stage": "click", "mode": "direct" },
    { "id": "C006", "stage": "click", "mode": "direct" },
    { "id": "C007", "stage": "click", "mode": "direct" },
    { "id": "C009", "stage": "click", "mode": "direct" },
    { "id": "C012", "stage": "click", "mode": "direct" },
    { "id": "C013", "stage": "click", "mode": "direct" },
    { "id": "C016", "stage": "click", "mode": "direct" },
    { "id": "C018", "stage": "click", "mode": "allocated", "basis": "equal" },
    { "id": "C020", "stage": "click", "mode": "fixed", "basis": "equal" },
    { "id": "C021", "stage": "click", "mode": "fixed", "basis": "equal" },
    { "id": "C070", "stage": "click", "mode": "direct", "leakage_flag": true },
    { "id": "C072", "stage": "click", "mode": "allocated", "basis": "equal", "leakage_flag": true },
    { "id": "C008", "stage": "lead", "mode": "direct" },
    { "id": "C014", "stage": "lead", "mode": "allocated", "basis": "equal" },
    { "id": "C019", "stage": "lead", "mode": "direct" },
    { "id": "C022", "stage": "lead", "mode": "fixed", "basis": "equal" },
    { "id": "C023", "stage": "lead", "mode": "direct" },
    { "id": "C024", "stage": "lead", "mode": "fixed", "basis": "equal" },
    { "id": "C038", "stage": "lead", "mode": "direct" },
    { "id": "C042", "stage": "lead", "mode": "direct" },
    { "id": "C043", "stage": "lead", "mode": "direct" },
    { "id": "C055", "stage": "lead", "mode": "fixed", "basis": "equal" },
    { "id": "C085", "stage": "lead", "mode": "direct", "leakage_flag": true },
    { "id": "C028", "stage": "contact", "mode": "direct" },
    { "id": "C075", "stage": "contact", "mode": "direct" },
    { "id": "C046", "stage": "qualified", "mode": "direct", "leakage_flag": true },
    { "id": "C047", "stage": "qualified", "mode": "direct" },
    { "id": "C048", "stage": "qualified", "mode": "direct" },
    { "id": "C049", "stage": "qualified", "mode": "fixed", "basis": "equal" },
    { "id": "C056", "stage": "qualified", "mode": "direct", "leakage_flag": true },
    { "id": "C029", "stage": "quote", "mode": "direct" },
    { "id": "C050", "stage": "quote", "mode": "direct" },
    { "id": "C065", "stage": "quote", "mode": "direct" },
    { "id": "C026", "stage": "policy", "mode": "fixed", "basis": "equal" },
    { "id": "C027", "stage": "policy", "mode": "direct" },
    { "id": "C030", "stage": "policy", "mode": "direct" },
    { "id": "C031", "stage": "policy", "mode": "direct" },
    { "id": "C032", "stage": "policy", "mode": "direct" },
    { "id": "C036", "stage": "policy", "mode": "direct" },
    { "id": "C039", "stage": "policy", "mode": "direct" },
    { "id": "C051", "stage": "policy", "mode": "direct" },
    { "id": "C054", "stage": "policy", "mode": "direct" },
    { "id": "C061", "stage": "policy", "mode": "direct" },
    { "id": "C062", "stage": "policy", "mode": "direct" },
    { "id": "C063", "stage": "policy", "mode": "direct" },
    { "id": "C076", "stage": "policy", "mode": "fixed", "basis": "equal" },
    { "id": "C077", "stage": "policy", "mode": "direct", "leakage_flag": true },
    { "id": "C052", "stage": "retained_13m", "mode": "fixed", "basis": "equal", "leakage_flag": true },
    { "id": "C071", "stage": "retained_13m", "mode": "direct", "leakage_flag": true },
    { "id": "C074", "stage": "retained_13m", "mode": "direct", "leakage_flag": true },
    { "id": "C059", "stage": "impression", "mode": "fixed", "basis": "equal" },
    { "id": "C060", "stage": "impression", "mode": "fixed", "basis": "equal" },
    { "id": "C084", "stage": "impression", "mode": "fixed", "basis": "equal" }
  ],
  "benchmark_values": [
    { "key": "lead_to_qualified", "value": 0.55, "source": "CAC_Model_v1.xlsx Diagnostic target" },
    { "key": "qualified_to_policy", "value": 0.3, "source": "CAC_Model_v1.xlsx Diagnostic target" },
    { "key": "persistency_13m", "value": 0.9, "source": "CAC_Model_v1.xlsx Diagnostic target" }
  ],
  "kpi_definitions": [
    {
      "key": "cac",
      "expression": "attributable_acquisition_spend / issued_policies",
      "description": "Customer acquisition cost per issued policy, sliced by channel, campaign, product, period (V3-INS-FR-003).",
      "unit": "currency_per_policy"
    }
  ]
}
